[
  {
    "photo_id": "bakersfield:photo:wool-growers-restaurant-01",
    "author_url": "",
    "attribution_url": "https://commons.wikimedia.org/wiki/File:Wool_Growers_Bakersfield_CA_EEBB_-_Basque_diaspora_in_the_United_States_-_Tagzania_-_1779755518276.jpg",
    "original_file_url": "https://upload.wikimedia.org/wikipedia/commons/3/31/Wool_Growers_Bakersfield_CA_EEBB_-_Basque_diaspora_in_the_United_States_-_Tagzania_-_1779755518276.jpg",
    "downloaded_file_url": "https://thumb.wikimedia.org/wikipedia/commons/thumb/3/31/Wool_Growers_Bakersfield_CA_EEBB_-_Basque_diaspora_in_the_United_States_-_Tagzania_-_1779755518276.jpg/1280px-Wool_Growers_Bakersfield_CA_EEBB_-_Basque_diaspora_in_the_United_States_-_Tagzania_-_1779755518276.jpg",
    "downloaded_on": "2026-10-23 00:00:00",
    "original_file": "Fotoğraflar/bakersfield_wool-growers-restaurant_01.jpg",
    "original_sha256": "b4f4b9ae682e456d6de31cf8c3a37a647ac97a6ade60a191b031c64b4cd7ae37",
    "web_file": "Teslimler/WebKopyalari/b4f4b9ae682e456d6de31cf8c3a37a647ac97a6ade60a191b031c64b4cd7ae37.webp",
    "web_sha256": "c91fb3c564c51d9e68293671d2d95f8fe4ebca855ed70c5cd39a2749844e937e",
    "web_width": 1200,
    "web_height": 1600,
    "derivation": "Özgün teslim dosyası korundu. EXIF yönü uygulandı; kırpma yapılmadan en çok 1600 px, WebP kalite 84. Önceki kaynak değişiklik notları ayrıca korunur.",
    "provenance_status": "Eksik alan var",
    "provenance_note": "Kaynakta ayrı fotoğrafçı profil bağlantısı bulunmadı; fotoğraf kaynak sayfasına atıf korunur. Bağlantı uydurulmaz."
  },
  {
    "photo_id": "bakersfield:photo:wool-growers-restaurant-02",
    "author_url": "",
    "attribution_url": "https://commons.wikimedia.org/wiki/File:Wool_Growers_Bakersfield_CA_EEBB_-_Basque_diaspora_in_the_United_States_-_Tagzania_-_1779755518633.jpg",
    "original_file_url": "https://upload.wikimedia.org/wikipedia/commons/6/6a/Wool_Growers_Bakersfield_CA_EEBB_-_Basque_diaspora_in_the_United_States_-_Tagzania_-_1779755518633.jpg",
    "downloaded_file_url": "https://thumb.wikimedia.org/wikipedia/commons/thumb/6/6a/Wool_Growers_Bakersfield_CA_EEBB_-_Basque_diaspora_in_the_United_States_-_Tagzania_-_1779755518633.jpg/1280px-Wool_Growers_Bakersfield_CA_EEBB_-_Basque_diaspora_in_the_United_States_-_Tagzania_-_1779755518633.jpg",
    "downloaded_on": "2026-10-23 00:00:00",
    "original_file": "Fotoğraflar/bakersfield_wool-growers-restaurant_02.jpg",
    "original_sha256": "ae64b30c1cd0404f53f949d2c3ec2a95e0830ea1ea45bbde9348210eed8e42bb",
    "web_file": "Teslimler/WebKopyalari/ae64b30c1cd0404f53f949d2c3ec2a95e0830ea1ea45bbde9348210eed8e42bb.webp",
    "web_sha256": "33556bcf6092d48e2bbfcbba3c281d5ca180aad0db939654353746fe9dca71a1",
    "web_width": 1200,
    "web_height": 1600,
    "derivation": "Özgün teslim dosyası korundu. EXIF yönü uygulandı; kırpma yapılmadan en çok 1600 px, WebP kalite 84. Önceki kaynak değişiklik notları ayrıca korunur.",
    "provenance_status": "Eksik alan var",
    "provenance_note": "Kaynakta ayrı fotoğrafçı profil bağlantısı bulunmadı; fotoğraf kaynak sayfasına atıf korunur. Bağlantı uydurulmaz."
  },
  {
    "photo_id": "bakersfield:photo:wool-growers-restaurant-03",
    "author_url": "",
    "attribution_url": "https://commons.wikimedia.org/wiki/File:Wool_Growers_Bakersfield_CA_EEBB_-_Basque_diaspora_in_the_United_States_-_Tagzania_-_1779755518772.jpg",
    "original_file_url": "https://upload.wikimedia.org/wikipedia/commons/6/67/Wool_Growers_Bakersfield_CA_EEBB_-_Basque_diaspora_in_the_United_States_-_Tagzania_-_1779755518772.jpg",
    "downloaded_file_url": "https://thumb.wikimedia.org/wikipedia/commons/thumb/6/67/Wool_Growers_Bakersfield_CA_EEBB_-_Basque_diaspora_in_the_United_States_-_Tagzania_-_1779755518772.jpg/1280px-Wool_Growers_Bakersfield_CA_EEBB_-_Basque_diaspora_in_the_United_States_-_Tagzania_-_1779755518772.jpg",
    "downloaded_on": "2026-10-23 00:00:00",
    "original_file": "Fotoğraflar/bakersfield_wool-growers-restaurant_03.jpg",
    "original_sha256": "dd203f2198e8b7b77fab195701f762dca40611d5aeab4dc3cf0df0868174edc1",
    "web_file": "Teslimler/WebKopyalari/dd203f2198e8b7b77fab195701f762dca40611d5aeab4dc3cf0df0868174edc1.webp",
    "web_sha256": "0e4e6f15e5ded0c8e2bc2103dd49e19913d00ca5272cfa491eb8a53bd3b265b9",
    "web_width": 1200,
    "web_height": 1600,
    "derivation": "Özgün teslim dosyası korundu. EXIF yönü uygulandı; kırpma yapılmadan en çok 1600 px, WebP kalite 84. Önceki kaynak değişiklik notları ayrıca korunur.",
    "provenance_status": "Eksik alan var",
    "provenance_note": "Kaynakta ayrı fotoğrafçı profil bağlantısı bulunmadı; fotoğraf kaynak sayfasına atıf korunur. Bağlantı uydurulmaz."
  },
  {
    "photo_id": "bakersfield:photo:dewars-candy-shop-01",
    "author_url": "https://commons.wikimedia.org/wiki/User:Leviclancy",
    "attribution_url": "https://commons.wikimedia.org/wiki/User:Leviclancy",
    "original_file_url": "https://upload.wikimedia.org/wikipedia/commons/2/23/Dewar%27s_Ice_Cream_Shop_in_Bakersfield%2C_California_02.jpg",
    "downloaded_file_url": "https://thumb.wikimedia.org/wikipedia/commons/thumb/2/23/Dewar%27s_Ice_Cream_Shop_in_Bakersfield%2C_California_02.jpg/1280px-Dewar%27s_Ice_Cream_Shop_in_Bakersfield%2C_California_02.jpg",
    "downloaded_on": "2026-10-23 00:00:00",
    "original_file": "Fotoğraflar/bakersfield_dewars-candy-shop_01.jpg",
    "original_sha256": "2acc143878c412ada053c5190fb379eb7cacff5260f1cc0d5aa5b667101d1a5b",
    "web_file": "Teslimler/WebKopyalari/2acc143878c412ada053c5190fb379eb7cacff5260f1cc0d5aa5b667101d1a5b.webp",
    "web_sha256": "5bbf7bb30e81d82e0c79600dfa97e52bc81b66a938af8ac5d3a3ffbcb7ea9958",
    "web_width": 1280,
    "web_height": 960,
    "derivation": "Özgün teslim dosyası korundu. EXIF yönü uygulandı; kırpma yapılmadan en çok 1600 px, WebP kalite 84. Önceki kaynak değişiklik notları ayrıca korunur.",
    "provenance_status": "Kayıttan doğrulandı",
    "provenance_note": ""
  },
  {
    "photo_id": "bakersfield:photo:kern-county-museum-01",
    "author_url": "https://commons.wikimedia.org/wiki/User:Ixfd64",
    "attribution_url": "https://commons.wikimedia.org/wiki/User:Ixfd64",
    "original_file_url": "https://upload.wikimedia.org/wikipedia/commons/c/ce/Havilah_Courier_building_at_Kern_County_Museum.jpg",
    "downloaded_file_url": "https://thumb.wikimedia.org/wikipedia/commons/thumb/c/ce/Havilah_Courier_building_at_Kern_County_Museum.jpg/1280px-Havilah_Courier_building_at_Kern_County_Museum.jpg",
    "downloaded_on": "2026-10-23 00:00:00",
    "original_file": "Fotoğraflar/bakersfield_kern-county-museum_01.jpg",
    "original_sha256": "e48439c32f84a06e00e561d12746d4707865142b93f773ea0a0c638851bf847f",
    "web_file": "Teslimler/WebKopyalari/e48439c32f84a06e00e561d12746d4707865142b93f773ea0a0c638851bf847f.webp",
    "web_sha256": "4b2696e237dc30edf7f33b8b70a752635f5ddb449933f2486eaf4e6b184fa9ed",
    "web_width": 1280,
    "web_height": 960,
    "derivation": "Özgün teslim dosyası korundu. EXIF yönü uygulandı; kırpma yapılmadan en çok 1600 px, WebP kalite 84. Önceki kaynak değişiklik notları ayrıca korunur.",
    "provenance_status": "Kayıttan doğrulandı",
    "provenance_note": ""
  },
  {
    "photo_id": "bakersfield:photo:buena-vista-museum-of-natural-history-and-science-01",
    "author_url": "https://commons.wikimedia.org/wiki/User:Skyman9999",
    "attribution_url": "https://commons.wikimedia.org/wiki/User:Skyman9999",
    "original_file_url": "https://upload.wikimedia.org/wikipedia/commons/e/ef/Buena_Vista_Museum_Exterior.jpg",
    "downloaded_file_url": "https://thumb.wikimedia.org/wikipedia/commons/thumb/e/ef/Buena_Vista_Museum_Exterior.jpg/1280px-Buena_Vista_Museum_Exterior.jpg",
    "downloaded_on": "2026-10-23 00:00:00",
    "original_file": "Fotoğraflar/bakersfield_buena-vista-museum-of-natural-history-and-science_01.jpg",
    "original_sha256": "1e17bd9d6100a29347778aaa896104d9fb95ad7957d500f2bf36de2625c19a29",
    "web_file": "Teslimler/WebKopyalari/1e17bd9d6100a29347778aaa896104d9fb95ad7957d500f2bf36de2625c19a29.webp",
    "web_sha256": "9e809b3afe815edc78c4f4fb1dedbf5c5b4cc8eed107679963ce8d42b9eef73f",
    "web_width": 1064,
    "web_height": 1600,
    "derivation": "Özgün teslim dosyası korundu. EXIF yönü uygulandı; kırpma yapılmadan en çok 1600 px, WebP kalite 84. Önceki kaynak değişiklik notları ayrıca korunur.",
    "provenance_status": "Kayıttan doğrulandı",
    "provenance_note": ""
  },
  {
    "photo_id": "bakersfield:photo:bakersfield-museum-of-art-01",
    "author_url": "https://en.wikivoyage.org/wiki/de:Benutzer:(WT-de)_Mistoffeles",
    "attribution_url": "https://en.wikivoyage.org/wiki/de:Benutzer:(WT-de)_Mistoffeles",
    "original_file_url": "https://upload.wikimedia.org/wikipedia/commons/2/24/Bakersfield_Museum_of_Art.jpg",
    "downloaded_file_url": "https://thumb.wikimedia.org/wikipedia/commons/thumb/2/24/Bakersfield_Museum_of_Art.jpg/1280px-Bakersfield_Museum_of_Art.jpg",
    "downloaded_on": "2026-10-23 00:00:00",
    "original_file": "Fotoğraflar/bakersfield_bakersfield-museum-of-art_01.jpg",
    "original_sha256": "7b007807c9b03a6d3fd32b397b24e8a7b4c59ebfaf83132f209fc12d69dfe59b",
    "web_file": "Teslimler/WebKopyalari/7b007807c9b03a6d3fd32b397b24e8a7b4c59ebfaf83132f209fc12d69dfe59b.webp",
    "web_sha256": "27b86845bc899665bef78bdd3d91894c6e002ca58deb2aae11e72ff208b8cb28",
    "web_width": 1280,
    "web_height": 960,
    "derivation": "Özgün teslim dosyası korundu. EXIF yönü uygulandı; kırpma yapılmadan en çok 1600 px, WebP kalite 84. Önceki kaynak değişiklik notları ayrıca korunur.",
    "provenance_status": "Kayıttan doğrulandı",
    "provenance_note": ""
  },
  {
    "photo_id": "bakersfield:photo:bakersfield-museum-of-art-02",
    "author_url": "",